Question,Answer
Error, I don't have enough knowlege to answer this question
It is alleged that this country 'sold out' to Argentina in a 1978 World Cup Group 2 game.  Who was it?,Peru
What two teams took part in the 1970 European Cup Finals?,Glasgow Celtic and Feyenoord
Where did Roberto Carlos of Brazil begin his career?,Union San Juan de Araras
How many countries participated in the 1954 World Cup?,16
The first International match was played between which two teams?,England and Scotland
How many matches were played in the 1998 World Cup?,64
What country and club team does Patrik Berger play for?,"Czech Republic, Liverpool"
Batistuta is going to which Italian club for the 2000-2001 series A season?,Roma
"Who missed the penalty kick for Italy in the finals of the 1994 World cup, which gave victory and the championship to Brazil?",Roberto Baggio
"Known as the 'Black  Spider', which goalkeeper is considered by most football historians to  be, technically, the greatest of all time?",Lev Yashin
'Gento still likes to  tell the story about how he would throw me the soap in the showers and I  could catch it with my left foot and keep it for a while. It's true.'  Of whom did Gento like to tell this story?,Ferenc Puskas
Kennedy Bakircioglou is a national of _________ ?,Sweden
Interesting fact, Cristiano Ronaldo had a friend which let him score the winning goal of a match so he can be the one that joins Sporting Lisabon
"When Ryan Giggs,  Manchester United's mercurial left winger, had his testimonial game for  the English giants, who were the opponents?",Celtic
Liverpool midfielder (2001-02) Patrik Berger is an international for which nation?,Czech Republic
"Brazilian legend, Jairzinho's name means __________ ?",Little Bird
"Rudi Vata plied his trade at many European clubs, but where does the talented midfielder call home?",Albania
"Who managed Scotland to a much vaunted, but again, unsuccessful World Cup campaign in Argentina 1978?",Ally McLeod
"In the Rod Stewart hit of the 1970s 'You're in my Heart', Red mentions two British football clubs. Which?",Celtic and Manchester United
"British Reggae Dance artist, Finlay Quaye played at schoolboy level for which British football club?",Hibernian
"Sunderland's left wing back (2001-02), Julia Arca is an international for which nation?",Argentina
"Gamba, Sanfrecce and Antlers are major clubs in which country's top football division?",Japan
Who scored the first ever goal in the English Premier League?, Brian Deane
What team won the inaugural MLS Cup in the United States?, D.C. United
Who is the all-time leading goal scorer in the MLS?, Chris Wondolowski
Who was the first ever winner of the Ballon d'Or?, Stanley Matthews
Who holds the record for the fastest goal in English Premier League history?, Shane Long
Who scored the first ever goal in the UEFA Champions League?, Daniel Amokachi
Who was the first player to score a goal in a World Cup final?, Jules Rimet
Who is the only player to have scored in every minute of a football game?, Cristiano Ronaldo
Who is the youngest footballer to have played in a World Cup final match?, Pelé
Who is the only player to have won the Champions League with three different clubs?, Clarence Seedorf
Who holds the record for the most goals scored in a single English Premier League season?, Mohamed Salah
Which club has the most consecutive English Premier League wins?, Liverpool
Who is the youngest player to score a hat-trick in the Champions League?, Raúl
Who is the player with the most goals in a single World Cup tournament?, Just Fontaine
Who was the first African player to win the Ballon d'Or?, George Weah
Who holds the record for most goals scored in a calendar year?, Lionel Messi
Which club has won the most Copa Libertadores titles?, Club Atlético Independiente
Who was the first player to score 5 goals in a single Champions League game?, Lionel Messi
Which player has the most appearances in UEFA club competitions?, Iker Casillas
Who was the first player to score a goal in the FIFA World Cup?, Lucien Laurent
Who has made the most appearances in the history of the English Premier League?, Gareth Barry
Who holds the record for most goals scored in the history of the Copa Libertadores?, Alberto Spencer
Which team has the most titles in the history of the Serie A?, Juventus
Which team has the most titles in the history of the Ligue 1?, Saint-Étienne
Who is the youngest player to score in a UEFA Champions League final?, Patrick Kluivert
Who holds the record for most goals scored in a single Serie A season?, Gonzalo Higuaín
Who holds the record for the fastest hat-trick in the history of the English Premier League?, Sadio Mané
Which country has the most titles in the history of the Copa America?, Uruguay
Who holds the record for most goals scored in a single English Premier League match?, Andrew Cole and Alan Shearer
Who is the all-time leading goal scorer in the history of the UEFA European Championship?, Michel Platini and Cristiano Ronaldo
Who holds the record for most goals scored in a single UEFA European Championship?, Michel Platini
Which country has the most titles in the history of the UEFA European Championship?, Germany and Spain
Who holds the record for most goals scored in a single season in the UEFA Champions League?, Lionel Messi
Who holds the record for most goals scored in the history of the UEFA Champions League?, Cristiano Ronaldo
Who holds the record for most goals scored in the history of the FIFA World Cup?, Miroslav Klose
Who was the first player to score a hat-trick in the FIFA World Cup?, Bert Patenaude
Who is the oldest player to score a goal in the FIFA World Cup?, Roger Milla
Which team has the most titles in the history of the Bundesliga?, Bayern Munich
Who holds the record for most goals scored in a single Bundesliga season?, Gerd Müller
Who was the first player to reach 100 appearances in the UEFA Champions League?, Raúl
Who is the oldest player to have played in a UEFA Champions League match?, Marco Ballotta
Which team has the most appearances in the UEFA Champions League final?, Real Madrid
Who holds the record for the most goals scored in a single Ligue 1 season?, Josip Skoblar
Which team has the most titles in the history of the La Liga?, Real Madrid
Who was the first player to score in six different club competitions in one season?, Lionel Messi
Who was the first player to score at least one goal in every minute of an official football game?, Cristiano Ronaldo
Who holds the record for the fastest hat-trick in the history of the Serie A?, Valentino Mazzola
Who is the oldest player to score a goal in the Serie A?, Alessandro Costacurta
Who is the youngest player to score a goal in the Bundesliga?, Nuri Sahin
Who holds the record for most goals scored in a single season in La Liga?, Lionel Messi
Who was the first player to score 50 goals in a single season in two major European leagues?, Lionel Messi
Who is the oldest player to have played in a FIFA World Cup match?, Faryd Mondragon
Which country has the most participations in the FIFA World Cup without ever winning the tournament?, Mexico
Who is the youngest player to have played in a FIFA World Cup match?, Norman Whiteside
Who holds the record for the most goals scored in a single season in the MLS?, Josef Martínez
Who is the youngest player to score a goal in the MLS?, Freddy Adu
Who holds the record for the most goals scored in a single season in the Chinese Super League?, Elkeson
Who was the first player to score a goal in the Chinese Super League?, Li Bing
Who holds the record for the most goals scored in a single season in the J1 League?, Masashi Nakayama
What is the nickname of the Spanish football team Real Madrid?, Los Blancos
What is the nickname of the English football team Liverpool FC?, The Reds
What is the nickname of the Argentinian football team Boca Juniors?, Los Xeneizes
What is the nickname of the Brazilian football team Flamengo?, Mengão
What is the nickname of the German football team Bayern Munich?, Die Roten
What is the nickname of the Dutch football team Ajax?, De Godenzonen
What is the nickname of the Italian football team Juventus?, La Vecchia Signora
What is the nickname of the French football team Paris Saint-Germain?, Les Parisiens
What is the nickname of the Scottish football team Celtic?, The Bhoys
What is the nickname of the Portuguese football team Benfica?, As Águias
What is the nickname of the Australian football team Sydney FC?, The Sky Blues
What is the nickname of the Mexican football team Club América?, Las Águilas
What is the nickname of the Egyptian football team Al Ahly?, The Club of the Century
What is the nickname of the Japanese football team Kashima Antlers?, Antlers
What is the nickname of the Chinese football team Guangzhou Evergrande?, Southern China Tigers
What is the nickname of the Turkish football team Galatasaray?, Cim Bom
What is the nickname of the Greek football team Olympiacos?, The Legend
What is the nickname of the Russian football team Spartak Moscow?, The People's Team
What is the nickname of the South African football team Kaizer Chiefs?, Amakhosi
What nickname is given to the English football team Manchester United?, The Red Devils
What is the Brazilian football team Palmeiras commonly known as?, Verdão
Which Spanish football team is known as Los Rojiblancos?, Atlético Madrid
What nickname is associated with the Italian football team AC Milan?, Rossoneri
What is the nickname of the English football team Arsenal FC?, The Gunners
What name is associated with the Dutch football team Feyenoord?, De club aan de Maas
What is the nickname of the German football team Borussia Dortmund?, Die Schwarzgelben
Which French football team is known as Les Gones?, Olympique Lyon
What is the nickname of the Portuguese football team FC Porto?, Dragões
Which Scottish football team is commonly referred to as The Gers?, Rangers FC
What name is often used to refer to the Australian football team Melbourne Victory?, Victory
What is the nickname of the Mexican football team Chivas?, Rebaño Sagrado
What is the nickname of the Egyptian football team Zamalek?, The White Knights
What is the nickname of the Japanese football team Urawa Red Diamonds?, Reds
Which Chinese football team is known as The Imperial Guards?, Beijing Guoan
What is the nickname of the Turkish football team Fenerbahçe?, Sarı Kanaryalar (Yellow Canaries)
What is the nickname of the Greek football team Panathinaikos?, The Greens
Which Russian football team is known as The Army Men?, CSKA Moscow
What is the nickname of the South African football team Orlando Pirates?, The Buccaneers
What is the nickname of the American football team Seattle Sounders FC?, Sounders
What was the nickname of Brazilian football legend Edson Arantes do Nascimento?, Pelé
What is the nickname of Argentine football star Lionel Messi?, La Pulga
What is the nickname of Portuguese footballer Cristiano Ronaldo?, CR7
What was the nickname of Argentine football legend Diego Maradona?, El Pibe de Oro
What is the nickname of Brazilian footballer Neymar?, Ney
What was the nickname of Dutch football legend Johan Cruyff?, The Flying Dutchman
What is the nickname of Egyptian footballer Mohamed Salah?, The Egyptian King
What was the nickname of English football legend Bobby Charlton?, Sir Bobby
What was the nickname of French footballer Zinedine Zidane?, Zizou
What is the nickname of Brazilian footballer Ronaldinho?, Ronnie
What is the nickname of French footballer Kylian Mbappé?, Donatello
What is the nickname of English footballer Harry Kane?, Hurrikane
What is the nickname of Italian footballer Gianluigi Buffon?, Superman
What was the nickname of Brazilian footballer Romário?, The Short One
What was the nickname of Hungarian football legend Ferenc Puskás?, The Galloping Major
What is the nickname of Belgian footballer Eden Hazard?, The Belgian Magician
What is the nickname of Uruguayan footballer Luis Suárez?, El Pistolero
What was the nickname of Brazilian footballer Zico?, The White Pele
What was the nickname of English footballer Paul Gascoigne?, Gazza
What is the nickname of Croatian footballer Luka Modrić?, Cruyff of the Balkans
Which Brazilian football legend is commonly known as Pelé?, Edson Arantes do Nascimento
Which Argentine football star is known as La Pulga?, Lionel Messi
Which Portuguese footballer is often referred to as CR7?, Cristiano Ronaldo
Which Argentine football legend was known as El Pibe de Oro?, Diego Maradona
Which Brazilian footballer is often called Ney?, Neymar
Which Dutch football legend was known as The Flying Dutchman?, Johan Cruyff
Which Egyptian footballer is often called The Egyptian King?, Mohamed Salah
Which English football legend was known as Sir Bobby?, Bobby Charlton
Which French footballer is often referred to as Zizou?, Zinedine Zidane
Which Brazilian footballer is often called Ronnie?, Ronaldinho
Which French footballer is known as Donatello?, Kylian Mbappé
Which English footballer is known as Hurrikane?, Harry Kane
Which Italian footballer is known as Superman?, Gianluigi Buffon
Which Brazilian footballer was known as The Short One?, Romário
Which Hungarian football legend was known as The Galloping Major?, Ferenc Puskás
Which Belgian footballer is known as The Belgian Magician?, Eden Hazard
Which Uruguayan footballer is known as El Pistolero?, Luis Suárez
Which Brazilian footballer was known as The White Pele?, Zico
Which English footballer is known as Gazza?, Paul Gascoigne
Which Croatian footballer is known as Cruyff of the Balkans?, Luka Modric
Which Spanish football team is known as Los Blancos?, Real Madrid
Which English football team is known as The Reds?, Liverpool FC
Which Argentinian football team is known as Los Xeneizes?, Boca Juniors
Which Brazilian football team is known as Mengão?, Flamengo
Which German football team is known as Die Roten?, Bayern Munich
Which Dutch football team is known as De Godenzonen?, Ajax
Which Italian football team is known as La Vecchia Signora?, Juventus
Which French football team is known as Les Parisiens?, Paris Saint-Germain
Which Scottish football team is known as The Bhoys?, Celtic
Which Portuguese football team is known as As Águias?, Benfica
Which Australian football team is known as The Sky Blues?, Sydney FC
Which Mexican football team is known as Las Águilas?, Club América
Which Egyptian football team is known as The Club of the Century?, Al Ahly
Which Japanese football team is known as Antlers?, Kashima Antlers
Which Chinese football team is known as Southern China Tigers?, Guangzhou Evergrande
Which Turkish football team is known as Cim Bom?, Galatasaray
Which Greek football team is known as The Legend?, Olympiacos
Which Russian football team is known as The People's Team?, Spartak Moscow
Which South African football team is known as Amakhosi?, Kaizer Chiefs
Which American football team is known as The G's?, Los Angeles Galaxy
Which national football team is known as La Seleção?, Brazil
Which national football team is known as La Albiceleste?, Argentina
Which national football team is known as Les Bleus?, France
Which national football team is known as Die Mannschaft?, Germany
Which national football team is known as Azzurri?, Italy
Which national football team is known as The Three Lions?, England
Which national football team is known as La Roja?, Spain
Which national football team is known as The Socceroos?, Australia
Which national football team is known as De Rode Duivels?, Belgium
Which national football team is known as Los Cafeteros?, Colombia
Which national football team is known as Oranje?, Netherlands
Which national football team is known as Canarinho?, Brazil
Which national football team is known as El Tri?, Mexico
Which national football team is known as The Super Eagles?, Nigeria
Which national football team is known as Samurai Blue?, Japan
Which national football team is known as Bafana Bafana?, South Africa
Which national football team is known as The Black Stars?, Ghana
Which national football team is known as The Reggae Boyz?, Jamaica
Which national football team is known as The All Whites?, New Zealand
Which national football team is known as Team Melli?, Iran
Which national football team is known as Brazil?, La Seleção
Which national football team is known as Argentina?, La Albiceleste
Which national football team is known as France?, Les Bleus
Which national football team is known as Germany?, Die Mannschaft
Which national football team is known as Italy?, Azzurri
Which national football team is known as England?, The Three Lions
Which national football team is known as Spain?, La Roja
Which national football team is known as Australia?, The Socceroos
Which national football team is known as Belgium?, De Rode Duivels
Which national football team is known as Colombia?, Los Cafeteros
Which national football team is known as Netherlands?, Oranje
What is another nickname for the Brazilian national football team?, Canarinho
Which national football team is known as Mexico?, El Tri
Which national football team is known as Nigeria?, The Super Eagles
Which national football team is known as Japan?, Samurai Blue
Which national football team is known as South Africa?, Bafana Bafana
Which national football team is known as Ghana?, The Black Stars
Which national football team is known as Jamaica?, The Reggae Boyz
Which national football team is known as New Zealand?, The All Whites
Which national football team is known as Iran?, Team Melli
Who is the youngest footballer to have played in a World Cup match?, Norman Whiteside
Who scored the fastest hat-trick in the Premier League?, Sadio Mane
What team has the most consecutive English top flight titles?, Liverpool FC
Who scored the first Golden Goal in the history of football?, Oliver Bierhoff
Which national team holds the record for the most goals scored in World Cup tournaments?, Brazil
Who was the first player to score a penalty in a World Cup?, Manuel Rosas
Who scored the first Premier League goal?, Brian Deane
Which country has the most Copa América titles?, Uruguay
Who was the first player to be sent off in a World Cup?, Carlos Alberto Paredes
Who holds the record for the most goals scored in a calendar year?, Lionel Messi
Who is the only player to have won the Champions League with three different clubs?, Clarence Seedorf
Who is the only coach to have won the UEFA Champions League three times in a row?, Zinedine Zidane
Which footballer has made the most appearances in the World Cup?, Lothar Matthaus
Who is the oldest goal scorer in the history of the World Cup?, Roger Milla
Which footballer has scored the most goals in European Championship history?, Cristiano Ronaldo
Who was the first player to score 5 goals in a single World Cup match?, Oleg Salenko
Who was the first African footballer to win the Ballon d'Or?, George Weah
Who holds the record for the most consecutive clean sheets in the Premier League?, Petr Cech
Who scored the 1000th goal in World Cup history?, Rob Rensenbrink
Who was the first player to miss a penalty in a World Cup shoot-out?, Uli Stielike
Which English team was the first to win the old English First Division now known as the Premier League?, Preston North End
Which goalkeeper has the most clean sheets in Premier League history?, Petr Cech
Who was the first non-European to win the Ballon d'Or?, George Weah
Who is the top scoring defender in Premier League history?, John Terry
Which club has won the most Serie A titles?, Juventus
Who is the all-time top scorer of the UEFA Europa League?, Radamel Falcao
Which country won the first ever football World Cup?, Uruguay
Who is the all-time top scorer in La Liga?, Lionel Messi
Who was the first player to receive a red card in a World Cup match?, Carlos Caszely
Who is the youngest ever scorer in the Champions League?, Ansu Fati
Which country won the first ever African Cup of Nations?, Egypt
Who is the highest scoring British player in La Liga history?, Gareth Bale
Who scored the fastest goal in World Cup history?, Hakan Şükür
Who holds the record for the most goals scored in a single Premier League season?, Mohamed Salah
Who is the all-time top scorer of the Copa Libertadores?, Alberto Spencer
Who was the first player to score in consecutive World Cup finals?, Vavá
Which country has the most Asian Cup victories?, Japan
Who is the most expensive footballer in history?, Neymar
Who scored the first goal in MLS history?, Eric Wynalda
Who is the only player to have scored in four different World Cups?, Miroslav Klose
Who is the only goalkeeper to have won the Ballon d'Or?, Lev Yashin
Who is the only player to have scored a hattrick of headers in a World Cup match?, Tomáš Skuhravý
Which footballer has won the most World Cups?, Pelé
Who scored the first ever goal in the UEFA Champions League?, Daniel Amokachi
Which player scored in both the Champions League final and the World Cup final in 2018?, Mario Mandzukic
Who is the only manager to have won the Copa Libertadores and UEFA Champions League?, José Mourinho
Who is the only player to have scored in a Manchester Merseyside and Glasgow derby?, Andrei Kanchelskis
Who is the oldest outfield player to have played in a World Cup match?, Essam El-Hadary
Who is the only player to have won the Champions League,
Who is the only player to have scored in four different World Cups?, Miroslav Klose
Who is the only goalkeeper to have won the Ballon d'Or?, Lev Yashin
Who is the only player to have scored a hattrick of headers in a World Cup match?, Tomáš Skuhravý
Which footballer has won the most World Cups?, Pelé
Who scored the first ever goal in the UEFA Champions League?, Daniel Amokachi
Which player scored in both the Champions League final and the World Cup final in 2018?, Mario Mandzukic
Who is the only manager to have won the Copa Libertadores and UEFA Champions League?, José Mourinho
Who is the only player to have scored in a Manchester Merseyside and Glasgow derby?, Andrei Kanchelskis
Who is the oldest outfield player to have played in a World Cup match?, Essam El-Hadary
Who is the only player to have won the Champions League World Cup and the Ballon d'Or in the same year?, Lionel Messi
Which manager won the English top-flight with two different clubs?, Herbert Chapman
Who scored the 2000th goal in World Cup history?, Marcus Allbäck
Who is the only player to have scored a World Cup goal in the 1990s 2000s and 2010s?, Rafael Márquez
Who is the only player to have scored in both a FA Cup final and a League Cup final in the same season?, Dalian Atkinson
Which manager has won the most Premier League Manager of the Month awards?, Sir Alex Ferguson 
World Cup and the Ballon d'Or in the same year?, Lionel Messi
Which manager won the English top-flight with two different clubs?, Herbert Chapman
Who scored the 2000th goal in World Cup history?, Marcus Allbäck
Who is the only player to have scored a World Cup goal in the 1990s 2000s and 2010s?, Rafael Márquez
Who is the only player to have scored in both a FA Cup final and a League Cup final in the same season?, Dalian Atkinson
Which manager has won the most Premier League Manager of the Month awards?, Sir Alex Ferguson
Who was the first footballer to score more than 50 goals in a season in two different leagues?, Lionel Messi
Martin O'Neill is well  known as a manager in England and Scotland. He is however an  accomplished player and boasts a European Cup Winners medal. With which  team did he win this medal?,Nottingham Forest
Hearts of Oak are a top ranking football team in which country?,Ghana
Which German international was given the nickname 'Das Bomber'?,Gerd Muller
FA Premier League: which team won the most titles in the nineties?,Manchester United
Where were the three World Cup finals played in the 1990s held?,"USA, France and Italy"
Who became the first person to captain and manage World Cup winning sides?,Franz Beckenbauer
"Complete the last two  teams in this list of FA Cup winners in the 1990s: Manchester United,  Tottenham Hotspur, Liverpool, Arsenal, Manchester United, Everton,  Manchester United, Chelsea, ________ and ________ ?",Arsenal and Manchester United
Which team were stripped of their European Cup win in 1992 due to financial irregularities?,Marseille
Which English team completed the unique double of League Cup and FA Cup in the same season?,Arsenal
"Which country won Euro 92, despite failing to qualify; being a late substitute for Yugoslavia?",Denmark
The World Cup in France  in 1998 sawn a record number of participants in the Finals. Which team  from the Concacaf region made their first appearance?,Jamaica
In 1990 which country became the first African nation to reach the last 8 of the World Cup finals?,Cameroon
The 1990 World Cup saw  the Republic of Ireland reach the World Cup finals for the first time  in their history. How far did they get?,Quarterfinals
In 1990 Liverpool secured the League championship for a record breaking ____ time?,18th
"Rangers dominated the  Scottish title in the nineties winning 9 titles, but in which year did  their deadly rivals Celtic win the League stopping what would have been a  record 10 in a row?",1998
"Which team became the first team to win the domestic treble in Ireland: League Championship, Cup and League Cup in 1989?",Derry City
The say 'Spurs always  win the cup when the year ends in ....': in which year of the nineties  did they prove this old saying correct?,1991
"Name the player that  has played for these clubs, in this order. West Ham United, Manchester  United, Inter Milan, Liverpool, Middlesborough?",Paul Ince
"June 2003 came the  biggest blockbuster of the summer, when La Liga Club Real Madrid sealed  the transfer deal of this super star. Who is he?",David Beckham
