Question,Answer
Who is the oldest player to have played in a World Cup match?, Essam El-Hadary
Who holds the record for the most Premier League appearances?, Gareth Barry
Who holds the record for the most consecutive clean sheets in the Premier League?, Petr Čech
Who holds the record for the most consecutive appearances in the Premier League?, Brad Friedel
Who holds the record for the fastest Premier League red card?, Tim Sherwood
Who holds the record for the most career red cards in the Premier League?, Duncan Ferguson and Patrick Vieira
Which team holds the record for the longest unbeaten run in the Premier League?, Arsenal (49 games)
Who holds the record for the most hat-tricks in the Premier League?, Sergio Aguero
Who holds the record for the most consecutive Premier League games scored in?, Jamie Vardy
Who holds the record for the most Premier League penalties saved?, David James
Who holds the record for the most own goals in the Premier League?, Richard Dunne
Who holds the record for the most Premier League yellow cards?, Gareth Barry
Who holds the record for the most goals in a single Premier League match?, Andrew Cole and Alan Shearer
Who holds the record for the most consecutive seasons scored in the Premier League?, Ryan Giggs
Who holds the record for the most appearances in the UEFA Champions League?, Iker Casillas
Who holds the record for the most goals scored in the UEFA Champions League?, Cristiano Ronaldo
Who holds the record for the most clean sheets in the UEFA Champions League?, Iker Casillas
Which team holds the record for the most UEFA Champions League titles?, Real Madrid
Who holds the record for the most appearances in FIFA World Cup tournaments?, Antonio Carbajal and Lothar Matthäus
Who holds the record for the most goals scored in European Championship tournaments?, Michel Platini and Cristiano Ronaldo
Which team holds the record for the most FIFA World Cup titles?, Brazil
Which team holds the record for the most European Championship titles?, Germany and Spain
This T is a London club that played at White Hart Lane until 2016.,Tottenham Hotspur
This U is an Italian club that commenced playing in Serie A in 1994-95.,Udinese
This V is a Portugese club that plays in white and represents the city of Portugal's first king.,Vitoria de Guimaraes
This W is an English club who changed the name of their ground from Upton Park.,West Ham United
"This X, a Spanish club is in a wine rich region.",Xerex
This one is doubled: this Y is an English league team. And this Z is a Spanish team (first name Real). Who are they?,"York City, Zaragoza"
Which country was the first to win the FIFA World Cup five times?,Brazil
"Since its inception in  the 1929-30 season, two teams had played in every season until 2006;  when one of them were relegated. Which club remained as the onlyone to  have played in Serie A every season?",Inter Milan
In which year did the English FA Premier League commence?,1992
Who was the first player to have won the FIFA Women's World Player of the Year five times in a row?,Marta
"Following remodelling and upgrades in 2009, which European soccer stadium had the largest capacity?",Camp Nou (Spain)
Which club has won the Bundesliga more than 30 times?,Bayern Munich
Which player won the 2021 Men's Ballon d'Or award?,Lionel Messi
Which soccer great was born Edson Arantes do Nascimento?,Pelé
Which player won the Golden Shoe at the 1991 inaugural FIFA Women's World Cup?,Michelle Akers
Who was the manager of the England national team at the 1966 World Cup finals played in England,Alf Ramsey
What famously happened to Ron Atkinson in his first game in charge of Nottingham Forest?,He stepped into the wrong dugout
Eric Cantona infamously kung-fu kicked an opposition fan. Which team was the victim a fan of?,Crystal Palace
"The famous words ""I  would love it"" will never be forgotten by the people who watched it that  famous night. Which manager had wound up Kevin Keegan though?",Sir Alex Ferguson
"In 2005, Liverpool  completed one of the greatest comebacks ever. Thye were 3-0 down at half  time in the Champions League final to AC Milan, regarded by many as one  of the best teams in the world, Liverpool fought back and took Milan to  penalties and won the trophy. Who was playing goalkeeper that famous  night in Istanbul?",Jerzy Dudek
"Brian Clough and Peter  Taylor were the perfect double act. Brian took him to every club he  worked at. Brian was the motivator and Peter was the tactician. That  friendship took a turn for the worse when Peter Taylor became the  manager of Derby County in the mid eighties, just one year after telling  Brian he was retiring. Peter Taylor signed one of Clough's biggest  assets when Clough was on holiday. Who was this?",John Robertson
"When Chelsea beat Arsenal in the Champions League quarter final in 2004, what did a tearful Claudio Ranieri say?",I am a crazy man
Bobby Charlton scored a hat-trick in the 1966 World Cup final as England defeated West Germany 4-2.,F
Which man scored an own goal in the 1991 FA Cup final in extra time to hand the trophy to Tottenham Hotspur?,Des Walker
Who scored the winning goal for Everton in an FA Cup final againt Manchester United in 1995?,Paul Rideout
Who has the 'Hand Of God'?,Diego Maradona
Which of the following players is a Brazilian player and set a record for the most goals scored in world cup matches?,Pele
"When going to make a throw in, what rules must you abide by?",All of these
"In the 1986 World Cup  quarter-final match between England and Argentina, this person scored a  controversial goal which was later referred as the ""Hand of God."" Who  was that player?",Diego Maradona
What happens when a player receives a red card during a match?,He is kicked out of the game
The World Cup is played once in how many years?,4
What country won the first World Cup?,Uruguay
What happens when a defending player kicks the ball out-of-bounds over his team's goal line?,Corner Kick
How many players on one team are allowed on the field at the start of the match?,11
Every year there is a competition between Europe's best premier teams. What is the name of this special tournament?,Champions League
Which of the following terms refers to a player who is not likely to score a goal?,Stopper
England went out of  World Cup 1990 on a penalty shoot-out against Germany.  Which of the  following missed a penalty for England in this all important shoot-out?,Stuart Pearce
"During Euro 1996,  England played rivals Scotland at Wembley, whose Scotland penalty was  superbly saved by England goalkeeper David Seaman?",Gary McAllister
"In the semi-finals of  Euro 96, England once again faced Germany for a place in the final. They  again lost the shoot-out. Who missed the last penalty for England?",Gareth Southgate
"World Cup 1998 saw  England involved in another penalty shoot-out, and this time they faced  Argentina. David Batty missed a penalty in this shoot-out, but which  other England player missed from the 12- yard spot?",Paul Ince
One of the semi-finals  at World Cup 1998 was also decided on a penalty shootout. Holland lost  to Brazil.  Which Holland defender missed his penalty?,Ronald de Boer
"In May 1999, Manchester  United played Arsenal in the FA Cup semi-final. Minutes before the end,  Arsenal saw a penalty saved by Danish stopper Peter Schmeichel.  Who  took that penalty?",Dennis Bergkamp
"In the semi-final of Euro 2000, a penalty was scored in the 117th minute, and acted as a golden goal.  Who scored this penalty?",Zinedene Zidane
"At the 2002 World Cup, England beat Argentina in the group stages thanks to a penalty scored by which midfielder?",David Beckham
England were beaten by hosts Portugal in a penalty shootout at Euro 2004.  Who scored Portugal's winning penalty?,Ricardo
The 2005 FA Cup final was decided on penalties. Who was the only player to miss a penalty in this shoot-out?,Paul Scholes
In what year was Glenn Hoddle born?,1957
This man won the European Footballer of the Year award in back-to-back years in 1978 and 1979. Who was he?,Kevin Keegan
Which year was the first FA Cup live in colour on TV?,1968
Which 3 clubs had Sir Alex Ferguson managed before Manchester United?,"East Stirling, St. Miren, Aberdeen"
"In the 1889 FA Cup Final, Preston North End beat which club to complete the first ever double?",Wolverhampton Wanderers
"On 25th January, 1964, Doncaster Rovers beat Darlington 10-0, but in what division was this game played?",Old 4th
Which four teams competed in the play-offs of the 1995-96 season in Division 1?,"Crystal Palace, Stoke City, Leicester City, Charlton Athletic"
Who finished in third place in the last season of the old 1st Division?,Sheffield Wednesday
How many different teams had won the original first Division before it was transfered into the Premier League?,23
"When Manchester United  won their record 9th FA Cup final in 1995-96, they beat Liverpool in  the final, but who did Liverpool beat 7-0 in the 3rd round?",Rochdale United
Peter Schmeichel played in goal for Manchester United in the FA Cup final of 1993?,f
How many times was the FA Cup Final contested at Kennington Oval?,20
Who won the Scottish Premier Division in 1978-79?,Celtic
Which 2 teams dominated the Scottish FA Cup between 1874 and 1882?,"Queens Park, Vale of Leven"
Who won the Welsh Cup in 1995-1996?,TNS LLansantffraid
Who won the FA Woman's National Division in 1995-1996?,Croydon
Who were the first English side to lose in an European Cup Final?,Leeds United
Who were Rangers' opponents in the first ever Cup Winner's Cup Final?,Fiorentina
Who were the champions of Malta in season 1995-1996?,Sliema Wanderers
In which League group were England placed in the first stage of Euro 96?,A
"Tempers flared during  the FA Cup quarter final between Everton and Chelsea in 2016, when the  volatile Diego Costa appeared to bite an Everton player, resulting in  him being sent off. Who was his alleged victim, who also received a red  card?",Gareth Barry
Of which offence was Wayne Rooney convicted in September 2017 while playing for Everton?,Driving with excess alcohol
"Which two goalkeepers, along with John Fashanu, were accused of match fixing in 1994?",Bruce Grobbelaar and Hans Segers
"Senegalese striker Ali  Dia was the centre of a hoax in 1996 when he claimed to be George Weah's  cousin, and was subsequently signed by Southampton on a one-month  contract. However, he turned out to be less than impressive. Who was the  unlucky manager taken in by Dia's deception?",Graeme Souness
"Which player was  arrested and imprisoned for ten months in 2012, after he got involved in  a drunken brawl while playing for Watford?",Troy Deeney
"Kevin Pressman was one  of Sheffield Wednesday's longest-serving players, but he also held the  less favourable record of being one of the fastest sendings-off in  league football, at just 13 seconds. What was Pressman's offence?",Handling the ball outside his area
"Sergio Ramos angered  both Liverpool fans and players alike in the 2017-2018 Champions' League  final between Liverpool and Real Madrid, when he committed a  particularly heinous foul that injured one of Liverpool's players. What  did he do?",He dislocated Mohamed Salah's shoulder.
"During a match between Newcastle United and Hull City, who was sent off for headbutting Hull's David Meyler?",Alan Pardew
"When Italy played  France in the 2006 World Cup final, Italy's Marco Materazzi insulted the  sister of France's Zinedine Zidane. How did Zidane respond?",He headbutted Materazzi.
"Jose Mourinho was one  of top-flight football's more notorious managers in terms of bad  behaviour. In fact, he got a two-match stadium ban during the 2005  Champions' League, while he was Chelsea manager, and was forbidden to  contact his staff at Chelsea when they were playing Bayern Munich. He  was supposed to be at a leisure centre, but instead snuck into Stamford  Bridge to give the team talk before the match. How did he avoid being  caught?",He hid in a laundry basket.
For which club did Pele play for most of his career?,Santos
How many goals did Eusebio score in the 1966 World Cup?,9
Which were the only two teams to have won three European Cups in a row in the 1970s?,Ajax and Bayern Munich
In which football club did Rui Costa of AC Milan started shining as a playmaker?,Benfica
Which of these former internationals is now coach at PSG?,Luis Fernandez
Who captained Benfica to their first European Cup in 1961?,Jose Aguas
Which of these Brazilian internationals was nicknamed 'The Doctor'?,Socrates
What club won the UEFA Cup back in 1983?,Anderlecht
"Who is the Portuguese  international that earned himself a transfer to Fiorentina from Benfica,  after a surprising performance in Euro 2000?",Nuno Gomes
Where does Poland international Radoslaw Kaluzny play his club football?,Germany
Which of these has had the most caps ever for England under 21s?,Jamie Carragher
How many steps were there up to the Royal Box at the old Wembley Stadium?,39
Which team won the Football League title in 1968?,Manchester City
Which player scored a hat-trick on his full debut before breaking the British transfer record twice in the 1990s?,Alan Shearer
What was the name of the  football fan attacked by Eric Cantona at Selhurst Park in 1995?,Matthew Simmonds
"Which player, originally born in Mozambique, won the Golden Boot at the 1966 World Cup?",Eusebio
Which French club were stripped of the League title in 1993 amid a match fixing scandal?,Marseille
"Which Belgian player, whose career was cut short due to injury, has changed the face of football transfers forever?",Jean-Marc Bosman
"Which team was the winner of the last ever European Cup Winners' Cup, in 1999?",Lazio
"In which stadium was the inaugural World Club Championships final played in 2000, between Corinthians and Vasco da Gama?",Maracana
What were the earliest football rules written down that are still in existence in 2005?,Rugby School
Which school withdrew from the first FA Cup competition without playing a game?,Donington
What was the result of the first match between Scotland and England played under association rules?,Scotland 0 England 0
What famous grassy park in Cambridge has often been referred to as 'The Birthplace of Football'?,Parker's Piece
"The first Sheffield  'derby', between Sheffield United and Sheffield Wednesday, was played on  a Monday rather than the traditional Saturday afternoon.",True
Which was the first northern club to win the FA Cup?,Blackburn Olympic
The first chairman of the Football Association represented which club?,Barnes
"In December 1863,  Francis Maule Campbell of Blackheath FC led a walkout from the Football  Association in protest at one particular rule being proposed. What was  the proposal to which he objected?",The outlawing of kicking your opponent (hacking)
Which public school was represented only as an observer at the first meeting of The Football Association?,Charterhouse
"Le Havre Athletic Club in France, the first French football club, was founded by Englishmen.",True
"June 1988, Euro final,   and Van Tiggelen broke up the attack and surged forward passing to  Muhren who looped over a deep cross. I took one outrageous kick and sent  it into the corner past Dasayev. Who am I?",Marco Van Basten
It was the 3rd place  play off in the World Cup of 1978. I received the ball out on the right.  I probably should've crossed it but I decided to have a go and beat  Dino Zoff at the far post. Who am I?,Nelinho
"August 1993, and a few  games into the premiership. A long ball played forward was knocked down  to me by Ian Dowie. It was slightly behind me so I flicked it back over  my head, over the head of Venison, around Howey and, then stroked it  past Hooper. Who am I?",Matt Le Tissier
"June 1966 and the  Wembley crowd were chanting for more goals, so I took up the ball in  midfield, dropped my shoulder to throw off a challenge and, unleashed a  rocket from 30 yards past the Mexican keeper. Who am I?",Bobby Charlton
"An FA Cup tie in 1994  against the Dons. Denis pumped a long ball into the box which was headed  clear, and straight to me. I took one touch to set it up then let fly  with a volley that screamed past Hans Segars. Who am I?",Eric Cantona
"Time was running out.  The Nou Camp was worried, and ghostly silent. Frank hit a long ball  forward to the edge of the box. As I had my back to goal, I had only one  option. I chested it into the air to set up an overhead kick which I  executed to perfection past Canizares.",Rivaldo
It was extra time and  we could not break down their defence. The South American's were holding  their own in this tough World Cup 2nd round match.  Robert put in a  hopeful cross which young David headed into my path. I didn't need a  touch. I put a low volley past Jose Luis and the game was ours. Who am  I?,Laurent Blanc
"The opening game of the  Wordl Cup, June 2006. What a privelege! Bastian rolled a free kick to  me, I let it run across my path before I belted it from 35 yards. Top  corner, what a goal. Who am I?",Thorsten Frings
"It was November 1999,  the Barca defence cleared it, but only to the edge of the box. The ball  bounced and, Heinrich headed up into the air. I don't know why but I  attempted a bicycle kick from fully 25 yards out. Would you believe it  went in. Who am I?",Mauro Bressan
"The world was watching  us, the opening game of the 1990 World Cup. We were in the mood for an  upset. They were not playing well and when the opportunity came, I leapt  higher than probably any footballer ever did. I headed it down, Pumpido  made a mess, and it went in.",Francois Omam-Biyik
Where and when was the first FIFA World Cup held that included England?,Brazil 1950
Which West German team did Liverpool beat 3-1 to win their first European Cup in 1977?,Borussia Moenchengladbach
From which Argentine club did Tottenham Hotspur buy Ricardo Villa in 1978?,Racing Club
Which club is officially recognised as the oldest existing club now playing competetive football?,Sheffield FC
Who was born Edson Arantes do Nascimento?,Pele
Which English Premier League club was originally founded as St Domingo FC?,Everton
Who was the first captain to lift the Jules Rimet Trophy?,Jose Nasazzi
"Who are known as ""The Old Lady""",Juventus
Who was the world's first million pound footballer?,Giuseppe Savoldi
"Which team are the reigning ""English Cup"" holders?",Burnley
Which player is nicknamed 'Little Buddha'?,Ivan De La Pena
Which South American country won the Copa America in 1979?,Paraguay
For which country does Zlatko Zahovic play for?,Slovenia
Who was Serie A's top scorer in the 99-00 season?,Shevchenko
Which of these clubs has NOT won the German Bundesliga title during the 1990s?,Bayer Leverkusen
What colour are IFK Gothenburg's home shorts?,Blue
"Which city do the Spanish side, Celta come from?",Vigo
Bastia come from which island?,Corsica
Which of the following clubs DO NOT come from Istanbul?,Trabzonspor
He was born in  February 1968 and is a former Italian international who was capped 28  times. He moved to Lazio from Foggia in the early 1990s and became Serie  A's leading goalscorer on three separate occasions. He stayed at the  Rome outfit for five seasons before moving to Bologna. Who is he?,Guiseppe Signori
Windsor Park is the home of which international side?,Northern Ireland
Ruben Sosa and Enzo Francescoli are former internationals for which nation?,Uruguay
In which country was the first indoor match played in the World Cup Finals?,USA
Name the Italian club that David Platt briefly managed?,Sampdoria
Which English speaking country lost 5-2 to Scotland in the 1982 World Cup?,New Zealand
Q : Niall _____  Republic Of Ireland striker.,Quinn
U : ______ Park was the home of West Ham United until 2016.,Upton
"I :  _____ Wright, former Arsenal footballer.",Ian
Z : ______ Data Systems. They were once sponsors a domestic football trophy?,Zenith
"M : Wolves striker from 2001 to 2006, Kenny ______ ?",Miller
A : Ajax play in this city?,Amsterdam
S : This team is located in Shropshire.,Shrewsbury
T : Flamboyant Brazilian goalkeeper of the 1980s and 90s.,Taffarel
E : A Merseyside club.,Everton
"R : Scottish team, Raith _____ .",Rovers
"When Real Madrid beat  Valencia 1-0 in 2000, how many times had Real Madrid won the European  Cup, or as it is now known, the Champions League?",8
Who scored the first goal of the France 98 World Cup?,Cesar Sampaio (Brazil)
Who is the only English team never to have been relegated up to the end of the 2000-01 season?,Wigan Athletic
What was the name of the 17-year-old 'Black Diamond' who starred as Brazil lifted the 1958 World Cup?,Pele
In which country do teams compete for Lo Scudetto?,Italy
"Who holds the record for most goals scored in the final stages of the World Cup (total, not just one competition)?",Gerd Muller
Which of the following grounds was not used in the English Football League in season 2000-01?,Deva Stadium
"When Blackburn Rovers won the Premiership title in season 1994-95, on which ground were they presented with the trophy?",Anfield
Against which team did Celtic clinch the SPL title in season 2000-01?,St Mirren
What was the score of the first ever Scotland v England international?,0-0
What colours are on the Australian jersey?,Green and Gold
What colours are on New Zealand's jersey?,White
The England jersey has white and what colour?,Blue
"Netherland's national flag colours are red, white and blue, but what colour is their soccer jersey?",Orange
Chile has what colours on their strip?,"Red, Blue and White"
Nigeria's colours are green and what?,White
Italy has what colours?,Blue and White
Japan have blue with what other colour?,White
Papua New Guinea have what colours?,Red and Black
"True or False: Sweden have the colours Blue, Yellow and White?",False
They played their home  games in the 2003 season at the Gemeindesportplatz and their name is FC  Ruggell.  Which country do they play in?,Liechtenstein
The Football Kingz FC played their home games at the Ericsson Stadium in the 2003 season: in which country?,New Zealand
"This football team  played their home games in the 2003 season, at the 30,000 Takhti stadium  in Ahvaz.  They are called Foolad.  Which country do they play in?",Iran
"This country has  football teams called Liberty Professionals, Mine Stars, Power FC,  Eleven Wise and Ebusua Dwarfs.  But which African country is it?",Ghana
"Playing their home games at a 40,000 all-seater stadium, in the 2003 season, where do Happy Valley Athletic play?","Hong Kong Stadium, Hong Kong"
The Concordia Stingers play their home games in Canada but do you know in which city?,Montreal
The United States have a whole host of soccer clubs in every state.  But in which state do the Reading Rage play?,Pennsylvania
In which American state would you find Fort Collins Force and Fort Lewis Skyhawks playing their soccer?,Colorado
"The home of football,  England, has an immense amount of football teams and players including  Accrington Stanley.  In which English county do they play their home  games?",Lancashire
"One of the  heavyweights of world football is Brazil.  The country has an obsession  with the game, hence the amazing amount of clubs.  Rio de Janeiro has  hundreds of clubs itself but can you tell me which of the following  teams does NOT play in Rio?",Clube de Fucius Fleuaria
What does the term PK mean?,penalty kick
Offside is when a player from the receives the ball when behind who?,second last opponent
The ball is kicked past  the goal line by the attacking team (between goal post and corner  flag). The kick taken by the other team is called a what?,goal kick
"When a player calls out 'square' to the player with the ball, the first player is where?",next to the other player
"When the score is still  tied at the end of a International Cup or National Finals game, a  ________ takes place, involving a series of shots on goal. What is this  called?",shoot out
Who was Cameroon's leading goal scorer in the 1990 World Cup?,Roger Milla
When did Australia compete in their first World Cup finals?,1974
How many penalty shots did Walter Zenga save in the 1990 semi final shootout against Argentina?,0
"What was the score in the first World Cup final where Uruguay defeated Argentina, in 1930?",4-2
Who scored the first hat-trick in the 1990 World Cup Finals?,Miguel Gonzalez Michel
Who scored the first ever World Cup goal?,Louis Larent
The Giuseppe Meazza stadium is home ground to which two Italian clubs?,A.C Milan and Inter Milan
"Romario had a bet with which player in the 1994 World Cup, that he would score the greater amount of goals?",Hristo Stoichkov
When was the great A.C. Milan team founded?,1899
Which country hosted the 1954 World Cup finals?,Switzerland
Who was the leading goal scorer of the 1966 World Cup?,Eusebio
What sport did Christian Vieri play (other than football or soccer) as a youngster?,Cricket
Which team won the Sydney 2000 Olympic soccer final?,Cameroon
Which country did Grzegor Lato represent?,Poland
Edson Arantes Do Nascimento is the real name of which football player?,Pele
"In 2004, who became the  youngest player to score in the European Championships, breaking  another players record that was broken earlier in the tournament?",Johan Vonlanthen
"In the very first World Cup, who scored the winning goal to give the cup to the host nation?",Castro
"The European Cup-Winners Cup finished in 1999, but who was the last team to lift the Cup?",Lazio
Which London Teams Books was David Beckham on as a Youth Player?,Tottenham
Who was the first player to score a hat trick in a World Cup final?,Sir Geoff Hurst
"Manchester United's  treble winning season was a big occasion in English football, but when  was the last time they won the European Cup prior to that?",1968
The Premierships power  seems to be shifting down to London with Chelsea and Arsenal the two top  teams.  Who was the first London team to win the English Championship?,Arsenal
